{"body":{"allow_zero_estimates":true,"cycle_cooldown_weeks":1,"cycle_duration_weeks":3,"cycle_start_day":2,"cycles_enabled":true,"estimate_scale":"t-shirt","identifier":"WRIT","name":"Writ Project","timezone":"America/New_York","triage_enabled":true},"object_id":"00000000000000000000000073657474","object_type":"settings","op_type":"set","op_version":1}