{"body":{"anchor":{"new":{"blob":"b7e23ec29af22b0b4e41da31e868d57226121c84","commit":"2ae787a3e353251a99120a6935bfd6b807e60d5a","context":{"after":["}","","// fold folds one op."],"before":["\tif err != nil {","\t\treturn nil, err","\t}"],"lines":["\tstate.Status = next","\tstate.UpdatedAt = op.Time","\treturn state, nil"]},"path":"engine/fold/review.go","range":{"end":43,"start":41}},"version":1},"subject":{"object_id":"rev-101","object_type":"review"},"text":"Should we also update the status transition log here?"},"object_id":"c-002","object_type":"comment","op_type":"create","op_version":1}